{
  "graph_id": "FGA-TRACE-1.0-20260726",
  "version": "1.0",
  "nodes": [
    {
      "id": "REQ-GOV-BASELINE-001",
      "kind": "requirement",
      "title": "Register authority and verified digests",
      "status": "verified"
    },
    {
      "id": "REQ-GOV-ID-001",
      "kind": "requirement",
      "title": "Use stable unique governance and delivery identifiers",
      "status": "verified"
    },
    {
      "id": "REQ-GOV-DELIVERY-001",
      "kind": "requirement",
      "title": "Enforce file-atomic tasks stages and iterations",
      "status": "verified"
    },
    {
      "id": "REQ-GOV-CLOSURE-001",
      "kind": "requirement",
      "title": "Enforce no-pass-no-progress closure",
      "status": "verified"
    },
    {
      "id": "REQ-GOV-TRACE-001",
      "kind": "requirement",
      "title": "Trace requirements through tests and evidence",
      "status": "verified"
    },
    {
      "id": "REQ-GOV-OWNERS-001",
      "kind": "requirement",
      "title": "Assign independent owners and reviewers",
      "status": "verified"
    },
    {
      "id": "REQ-GOV-CHANGE-001",
      "kind": "requirement",
      "title": "Classify changes by consequence",
      "status": "verified"
    },
    {
      "id": "REQ-GOV-EVIDENCE-001",
      "kind": "requirement",
      "title": "Generate schema-valid reproducible evidence",
      "status": "verified"
    },
    {
      "id": "REQ-GOV-MODULES-001",
      "kind": "requirement",
      "title": "Register all twenty modules",
      "status": "verified"
    },
    {
      "id": "REQ-GOV-INTERACTIONS-001",
      "kind": "requirement",
      "title": "Register all nineteen interactions",
      "status": "verified"
    },
    {
      "id": "M01",
      "kind": "module",
      "title": "Governed module M01",
      "status": "planned"
    },
    {
      "id": "M02",
      "kind": "module",
      "title": "Governed module M02",
      "status": "planned"
    },
    {
      "id": "M03",
      "kind": "module",
      "title": "Governed module M03",
      "status": "planned"
    },
    {
      "id": "M04",
      "kind": "module",
      "title": "Governed module M04",
      "status": "planned"
    },
    {
      "id": "M05",
      "kind": "module",
      "title": "Governed module M05",
      "status": "planned"
    },
    {
      "id": "M06",
      "kind": "module",
      "title": "Governed module M06",
      "status": "planned"
    },
    {
      "id": "M07",
      "kind": "module",
      "title": "Governed module M07",
      "status": "planned"
    },
    {
      "id": "M08",
      "kind": "module",
      "title": "Governed module M08",
      "status": "planned"
    },
    {
      "id": "M09",
      "kind": "module",
      "title": "Governed module M09",
      "status": "planned"
    },
    {
      "id": "M10",
      "kind": "module",
      "title": "Governed module M10",
      "status": "planned"
    },
    {
      "id": "M11",
      "kind": "module",
      "title": "Governed module M11",
      "status": "planned"
    },
    {
      "id": "M12",
      "kind": "module",
      "title": "Governed module M12",
      "status": "planned"
    },
    {
      "id": "M13",
      "kind": "module",
      "title": "Governed module M13",
      "status": "planned"
    },
    {
      "id": "M14",
      "kind": "module",
      "title": "Governed module M14",
      "status": "planned"
    },
    {
      "id": "M15",
      "kind": "module",
      "title": "Governed module M15",
      "status": "planned"
    },
    {
      "id": "M16",
      "kind": "module",
      "title": "Governed module M16",
      "status": "planned"
    },
    {
      "id": "M17",
      "kind": "module",
      "title": "Governed module M17",
      "status": "planned"
    },
    {
      "id": "M18",
      "kind": "module",
      "title": "Governed module M18",
      "status": "planned"
    },
    {
      "id": "M19",
      "kind": "module",
      "title": "Governed module M19",
      "status": "planned"
    },
    {
      "id": "M20",
      "kind": "module",
      "title": "Governed module M20",
      "status": "planned"
    },
    {
      "id": "I01",
      "kind": "interaction",
      "title": "Governed interaction I01",
      "status": "planned"
    },
    {
      "id": "I02",
      "kind": "interaction",
      "title": "Governed interaction I02",
      "status": "planned"
    },
    {
      "id": "I03",
      "kind": "interaction",
      "title": "Governed interaction I03",
      "status": "planned"
    },
    {
      "id": "I04",
      "kind": "interaction",
      "title": "Governed interaction I04",
      "status": "planned"
    },
    {
      "id": "I05",
      "kind": "interaction",
      "title": "Governed interaction I05",
      "status": "planned"
    },
    {
      "id": "I06",
      "kind": "interaction",
      "title": "Governed interaction I06",
      "status": "planned"
    },
    {
      "id": "I07",
      "kind": "interaction",
      "title": "Governed interaction I07",
      "status": "planned"
    },
    {
      "id": "I08",
      "kind": "interaction",
      "title": "Governed interaction I08",
      "status": "planned"
    },
    {
      "id": "I09",
      "kind": "interaction",
      "title": "Governed interaction I09",
      "status": "planned"
    },
    {
      "id": "I10",
      "kind": "interaction",
      "title": "Governed interaction I10",
      "status": "planned"
    },
    {
      "id": "I11",
      "kind": "interaction",
      "title": "Governed interaction I11",
      "status": "planned"
    },
    {
      "id": "I12",
      "kind": "interaction",
      "title": "Governed interaction I12",
      "status": "planned"
    },
    {
      "id": "I13",
      "kind": "interaction",
      "title": "Governed interaction I13",
      "status": "planned"
    },
    {
      "id": "I14",
      "kind": "interaction",
      "title": "Governed interaction I14",
      "status": "planned"
    },
    {
      "id": "I15",
      "kind": "interaction",
      "title": "Governed interaction I15",
      "status": "planned"
    },
    {
      "id": "I16",
      "kind": "interaction",
      "title": "Governed interaction I16",
      "status": "planned"
    },
    {
      "id": "I17",
      "kind": "interaction",
      "title": "Governed interaction I17",
      "status": "planned"
    },
    {
      "id": "I18",
      "kind": "interaction",
      "title": "Governed interaction I18",
      "status": "planned"
    },
    {
      "id": "I19",
      "kind": "interaction",
      "title": "Governed interaction I19",
      "status": "planned"
    },
    {
      "id": "I00-S01",
      "kind": "stage",
      "title": "Baseline registration",
      "status": "implemented"
    },
    {
      "id": "I00-S02",
      "kind": "stage",
      "title": "Delivery hierarchy",
      "status": "implemented"
    },
    {
      "id": "I00-S03",
      "kind": "stage",
      "title": "Traceability and change control",
      "status": "implemented"
    },
    {
      "id": "I00-S04",
      "kind": "stage",
      "title": "Initial evidence tooling contract",
      "status": "implemented"
    },
    {
      "id": "I00-S01-T01",
      "kind": "task",
      "title": "Record normative baseline",
      "path": "docs/governance/NORMATIVE_BASELINE.md",
      "status": "implemented"
    },
    {
      "id": "I00-S01-T02",
      "kind": "task",
      "title": "Define stable IDs",
      "path": "docs/governance/REQUIREMENT_ID_POLICY.md",
      "status": "implemented"
    },
    {
      "id": "I00-S01-T03",
      "kind": "task",
      "title": "Register governing artifacts",
      "path": "config/governance/baseline.json",
      "status": "implemented"
    },
    {
      "id": "I00-S01-T04",
      "kind": "task",
      "title": "Define baseline schema",
      "path": "schemas/governance/baseline.schema.json",
      "status": "implemented"
    },
    {
      "id": "I00-S02-T01",
      "kind": "task",
      "title": "Define delivery hierarchy",
      "path": "docs/delivery/TASK_STAGE_ITERATION_MODEL.md",
      "status": "implemented"
    },
    {
      "id": "I00-S02-T02",
      "kind": "task",
      "title": "Define readiness",
      "path": "docs/delivery/DEFINITION_OF_READY.md",
      "status": "implemented"
    },
    {
      "id": "I00-S02-T03",
      "kind": "task",
      "title": "Define completion",
      "path": "docs/delivery/DEFINITION_OF_DONE.md",
      "status": "implemented"
    },
    {
      "id": "I00-S02-T04",
      "kind": "task",
      "title": "Encode iteration policy",
      "path": "config/governance/iteration-policy.yaml",
      "status": "implemented"
    },
    {
      "id": "I00-S03-T01",
      "kind": "task",
      "title": "Define traceability",
      "path": "docs/governance/TRACEABILITY_MODEL.md",
      "status": "implemented"
    },
    {
      "id": "I00-S03-T02",
      "kind": "task",
      "title": "Define traceability schema",
      "path": "schemas/governance/traceability.schema.json",
      "status": "implemented"
    },
    {
      "id": "I00-S03-T03",
      "kind": "task",
      "title": "Assign owners and reviewers",
      "path": "config/governance/owners.yaml",
      "status": "implemented"
    },
    {
      "id": "I00-S03-T04",
      "kind": "task",
      "title": "Classify changes",
      "path": "docs/governance/CHANGE_CLASSIFICATION.md",
      "status": "implemented"
    },
    {
      "id": "I00-S04-T01",
      "kind": "task",
      "title": "Define evidence format",
      "path": "docs/testing/EVIDENCE_BUNDLE_FORMAT.md",
      "status": "implemented"
    },
    {
      "id": "I00-S04-T02",
      "kind": "task",
      "title": "Define evidence schema",
      "path": "schemas/testing/iteration-evidence.schema.json",
      "status": "implemented"
    },
    {
      "id": "I00-S04-T03",
      "kind": "task",
      "title": "Create I00 evidence",
      "path": "reports/iteration-00/evidence.json",
      "status": "implemented"
    },
    {
      "id": "I00-S04-T04",
      "kind": "task",